local_government_code,postal_code_5digit,postal_code_7digit,prefecture_kana,address1_kana,address2_kana,prefecture_kanji,address1_kanji,address2_kanji,is_address2_has_multiple_postal_code,is_address2_has_multiple_sublocality,is_address2_includes_chome,is_postal_code_has_multiple_address2,updated_type,updated_reason_type
26106,600  ,6008146,ｷｮｳﾄﾌ,ｷｮｳﾄｼｼﾓｷﾞｮｳｸ,ｻﾞｲﾓｸﾁｮｳ,京都府,京都市下京区,材木町（間之町通七条下る、間之町通七条上る、河原町通七条上,0,0,0,0,0,0
26106,600  ,6008146,ｷｮｳﾄﾌ,ｷｮｳﾄｼｼﾓｷﾞｮｳｸ,ｻﾞｲﾓｸﾁｮｳ,京都府,京都市下京区,る、河原町通七条下る、七条通間之町西入、七条通間之町東入、七条通河原町西,0,0,0,0,0,0
26106,600  ,6008146,ｷｮｳﾄﾌ,ｷｮｳﾄｼｼﾓｷﾞｮｳｸ,ｻﾞｲﾓｸﾁｮｳ,京都府,京都市下京区,入、七条通河原町東入、七条通高倉西入、七条通高倉東入、七条通土手町,0,0,0,0,0,0
26106,600  ,6008146,ｷｮｳﾄﾌ,ｷｮｳﾄｼｼﾓｷﾞｮｳｸ,ｻﾞｲﾓｸﾁｮｳ,京都府,京都市下京区,西入、七条通東洞院東入、高倉通七条上る、高倉通七条下る、土手町通七条,0,0,0,0,0,0
26106,600  ,6008146,ｷｮｳﾄﾌ,ｷｮｳﾄｼｼﾓｷﾞｮｳｸ,ｻﾞｲﾓｸﾁｮｳ,京都府,京都市下京区,上る、東洞院通七条下る、柳馬場通七条上る）,0,0,0,0,0,0
