code,postal_old,postal_new,pref_kana,address1_kana,address2_kana,pref,address1,address2,is_multi_code,is_koaza,is_choume,is_multi_place,is_updated,update_reason
36207,77121,7712102,ﾄｸｼﾏｹﾝ,ﾐﾏｼ,ﾐﾏﾁｮｳ(ｲｴﾉﾏｴ､ｵｵｲｹ､ｵｵｳｴ､ｵｵｷﾀ､ｵｵｻｺ､ｵｵﾏｴ､ｵｶﾉｳﾁ､ｵｼｱｹﾞ､ｶﾔﾊﾞﾗ､,徳島県,美馬市,美馬町（家ノ前、大池、大上、大北、大佐古、大前、岡ノ内、押上、茅原、,1,0,0,0,0,0
36207,77121,7712102,ﾄｸｼﾏｹﾝ,ﾐﾏｼ,ｶﾜﾉｳｴ､ｶﾝﾉﾝ､ｸﾘﾊﾞﾔｼ､ｸﾛｽﾅ､ｻﾙｶﾞｳﾁ､ｻﾙｻｶ､ｼﾓｼﾛｼﾞ､ｼﾛｼﾞ､ｽﾐｶﾞﾏ､ｾﾘｻﾞｺ､ｿｳｺﾞ､,徳島県,美馬市,川ノ上、観音、栗林、黒砂、狙ケ内、猿坂、下白地、白地、炭釜、芹佐古、惣後、,1,0,0,0,0,0
36207,77121,7712102,ﾄｸｼﾏｹﾝ,ﾐﾏｼ,ｿｳﾀﾞ､ｿﾄﾊﾞｶ､ﾀｷﾉｳｴ､ﾀﾂﾐﾔﾏ､ﾀﾉｵｶ､ﾀﾝｻﾞｶ､ﾅｶｵｶ､ﾅｶﾉﾀﾉｲ､ﾅｶﾖｺｵ､ﾅｶﾞｼﾞ､,徳島県,美馬市,惣田、外墓、滝ノ上、立見山、田ノ岡、狙坂、中岡、中野田ノ井、中横尾、長地、,1,0,0,0,0,0
36207,77121,7712102,ﾄｸｼﾏｹﾝ,ﾐﾏｼ,ﾆｼｳﾗ､ﾆｼﾉﾀﾆ､ﾉﾀﾉｲ､ﾊｼﾀﾞﾆ､ﾊﾞｼﾄｺ､ﾋｶﾞｼｽｼﾞ､ﾋﾗｵ､ﾋﾗﾉ､ﾌｼﾞﾕｳ､ﾏｴｻﾞｶ､,徳島県,美馬市,西浦、西ノ谷、野田ノ井、橋谷、場シ所、東筋、平尾、平野、藤宇、前坂、,1,0,0,0,0,0
36207,77121,7712102,ﾄｸｼﾏｹﾝ,ﾐﾏｼ,ﾐｽﾞﾉｵｶ､ﾐｿｶﾞｸﾎﾞ､ﾐﾁﾉｳｴ､ﾐﾔﾉｵｶ､ﾑﾅﾊﾞﾀ､ﾔｸｼｶﾞｸﾎﾞ､ﾔﾏﾆｼﾔｼｷ､,徳島県,美馬市,水ノ岡、味噌ケ久保、道ノ上、宮ノ岡、南畠、薬師ケ久保、山西屋敷、,1,0,0,0,0,0
36207,77121,7712102,ﾄｸｼﾏｹﾝ,ﾐﾏｼ,ﾔﾏﾊｼﾀﾞﾆ､ﾖｺｵ),徳島県,美馬市,山橋谷、横尾）,1,0,0,0,0,0
